greek,russian,english,example,category
εκτελώ καθήκοντα,выполнять обязанности,perform tasks,Ο αντιπρόεδρος εκτελεί καθήκοντα πρωθυπουργού κατά τη διάρκεια της απουσίας του.,Ιστορία 43
διαχείριση χρόνου με νόημα,осмысленное управление временем,meaningful time management,Η διαχείριση χρόνου με νόημα αποτελεί κλειδί για την παραγωγικότητα στη σύγχρονη εποχή.,Ιστορία 43
διεύθυνση,руководство / управление,management,Η διεύθυνση του οργανισμού ανακοίνωσε αλλαγές στον τρόπο λειτουργίας από τον Ιανουάριο.,Ιστορία 27
ο φορέας,"организация, учреждение",institution / body,Ο φορέας που εποπτεύει τα Μνημεία Παγκόσμιας Κληρονομιάς εξέδωσε νέες κατευθυντήριες γραμμές.,Γ2 exam
πραγματοποιώ,осуществлять / реализовывать,to accomplish / implement,Η αστυνομία πραγματοποιεί ελέγχους σε ολόκληρη τη χώρα για παράνομο εμπόριο.,3 Mar
συντονίζεται,координируется,coordinates,Η εθνική δράση για την πολιτική προστασία συντονίζεται πλέον μέσω ψηφιακής πλατφόρμας.,Γ2 exam
υλοποιώ,"реализовывать, осуществлять",implement,Ο δήμος υλοποιεί πρόγραμμα ανάπλασης δημόσιων χώρων πρασίνου στο κέντρο.,22 Dec
καταστρέφω,разрушаю,destroy,Η ρύπανση καταστρέφει οικοσυστήματα που χρειάζονται δεκαετίες για να ανακάμψουν.,6 Jan
τάση,тенденция,tendency / trend,Η τάση φυγής νέων επιστημόνων στο εξωτερικό παραμένει ανησυχητικά υψηλή.,24 Mar
προέρχομαι,происходить,to originate,Τα κονδύλια προέρχονται από ευρωπαϊκά προγράμματα χρηματοδότησης και εθνικούς πόρους.,13 May
ακυρώνομαι,отменяюсь,to be canceled,Δεκάδες πτήσεις ακυρώθηκαν λόγω της απεργίας των ελεγκτών εναέριας κυκλοφορίας.,20 Dec
ακυρώνω,отменять,to cancel,Το δικαστήριο ακυρώνει την απόφαση ως αντισυνταγματική μετά την προσφυγή πολιτών.,25 Sep
μεταβάλλομαι,изменяться,to change / be altered,Η κατάσταση στην αγορά μεταβάλλεται ραγδαία εξαιτίας των διεθνών εξελίξεων.,Γ2 exam
μεταβάλλω,изменять,to change,Οι νέοι κανονισμοί μεταβάλλουν ριζικά το τοπίο στον ενεργειακό τομέα.,Part 4
υπερβάλλω,преувеличивать,to exaggerate,Ο αναλυτής τόνισε ότι δεν υπερβάλλει όταν μιλά για κίνδυνο ύφεσης.,24 Mar
αναδύομαι,выныривать / появляться,to emerge,Νέες προκλήσεις αναδύονται στον τομέα της κυβερνοασφάλειας σε ευρωπαϊκό επίπεδο.,17 Mar
δεν έχω κόσμο στα πόδια μου,никого вокруг нет,not surrounded by people,Ο πολιτικός δεν έχει κόσμο στα πόδια του μετά τις αποτυχημένες υποσχέσεις.,17 Feb
Δεν επιδέχεται απλουστεύσεις.,Не допускает упрощений.,It does not allow for oversimplification.,"Το ζήτημα της μετανάστευσης δεν επιδέχεται απλουστεύσεις, τόνισε ο εμπειρογνώμονας.",Фразы уровня Γ2
δεν κολώνω,не робею,I don't back off,Ο ερευνητής δημοσιογράφος δεν κολώνει μπροστά στις απειλές και συνεχίζει.,30 May
Δεν μπορεί να αγνοηθεί η ιστορική διάσταση.,Нельзя игнорировать историческое измерение.,The historical dimension cannot be ignored.,"Δεν μπορεί να αγνοηθεί η ιστορική διάσταση του ζητήματος, σημειώνουν οι ιστορικοί.",Фразы уровня Γ2
Δεν πρόκειται για μεμονωμένο φαινόμενο.,Это не единичное явление.,It is not an isolated phenomenon.,"Δεν πρόκειται για μεμονωμένο φαινόμενο, αλλά για συστημικό πρόβλημα στη διοίκηση.",Фразы уровня Γ2
εξακολουθούν,продолжают,they continue,Εξακολουθούν να υφίστανται σημαντικές ανισότητες μεταξύ αστικών και αγροτικών περιοχών.,Γ2 exam
εξακολουθώ,продолжать,to continue / persist,Οι εργαζόμενοι εξακολουθούν να διαμαρτύρονται παρά τις κυβερνητικές υποσχέσεις.,24 Mar
ευμετάβλητη,"изменчивый, непостоянный","changeable, volatile",Η ευμετάβλητη πολιτική κατάσταση δυσκολεύει τον μακροπρόθεσμο σχεδιασμό στη χώρα.,Ιστορία 35
ευμετάβλητος,переменчивый,changeable,Ο ευμετάβλητος καιρός προκάλεσε σειρά προβλημάτων στις αγροτικές περιοχές της Κρήτης.,13 May
εφαρμογή αλλαγών,внедрение изменений,implementing changes,Η εφαρμογή αλλαγών στον δημόσιο τομέα απαιτεί χρόνο και πολιτική βούληση.,Ιστορία 34
μεταβολή,изменение,change,Η μεταβολή του ΑΕΠ σημείωσε θετικό πρόσημο για πρώτη φορά μετά από τρία χρόνια.,13 May
συγκρότημα,группа / комплекс,"band, complex",Το βιομηχανικό συγκρότημα θα μετατραπεί σε χώρο πολιτισμού και τέχνης.,14 Jan
συγκρότηση άποψης,формирование мнения,formation of an opinion,Η συγκρότηση άποψης απαιτεί πρόσβαση σε αξιόπιστες πηγές ενημέρωσης.,5 Dec
αβάσιμη πληροφορία,необоснованная информация,baseless information,Η αβάσιμη πληροφορία διαδόθηκε ταχύτατα μέσω των κοινωνικών δικτύων.,Ιστορία 37
αδιάκοπος,непрекращающийся,incessant,Η αδιάκοπη ροή πληροφοριών στα μέσα κοινωνικής δικτύωσης δημιουργεί πληροφοριακό κορεσμό.,22 Aug
αναλλοίωτη,неизменная,"unaltered, unchanged",Η αρχιτεκτονική κληρονομιά παρέμεινε αναλλοίωτη χάρη στις προσπάθειες διατήρησης.,23 Oct
ανεπίσημος / άτυπος,неофициальный,informal,Ανεπίσημες πηγές αναφέρουν ότι η συμφωνία θα ανακοινωθεί εντός της εβδομάδας.,14 May
ανεπανόρθωτες βλάβες,непоправимый ущерб,irreparable damages,Οι ανεπανόρθωτες βλάβες στο οικοσύστημα προκάλεσαν σφοδρές αντιδράσεις από περιβαλλοντικές οργανώσεις.,Γ2 exam
αντοχή,выносливость,endurance,Η αντοχή της ελληνικής κοινωνίας δοκιμάστηκε από αλλεπάλληλες κρίσεις σε μία δεκαετία.,22 Aug
αποτρέπω,предотвращать,to prevent,Τα νέα μέτρα ασφαλείας αποτρέπουν την παράνομη είσοδο στις κρίσιμες υποδομές.,20 Feb
αρχάριος / αρχάρια,новичок,beginner,Τα μαθήματα για αρχάριους ξεκινούν τον Σεπτέμβριο στο κέντρο εκπαίδευσης ενηλίκων.,13 Feb
αυξάνομαι,увеличиваюсь,to increase,Ο αριθμός των τουριστών αυξάνεται σταθερά κάθε χρόνο στα ελληνικά νησιά.,10 Jan
αυξήσει,увеличить,to increase,Η κυβέρνηση δεσμεύτηκε να αυξήσει τον κατώτατο μισθό κατά 7% εντός του τρέχοντος έτους.,Γ2 exam
αυτούσιος,"нетронутый, неизменный","intact, unaltered","Το αρχαίο κείμενο δημοσιεύτηκε αυτούσιο, χωρίς σχολιασμό ή ερμηνευτικές παρεμβάσεις.",Γ2 exam
γίνομαι,становиться,become,Η Ελλάδα γίνεται σταδιακά ελκυστικός προορισμός για ψηφιακούς νομάδες από όλο τον κόσμο.,18 Mar — ίσταμαι verbs
διακόπτω,прерывать,to interrupt,Ο πρόεδρος διακόπτει τη συνεδρίαση λόγω σοβαρών επεισοδίων μεταξύ βουλευτών.,19 May
διαμόρφωση,формирование,formation / shaping,Η διαμόρφωση κοινής ευρωπαϊκής εξωτερικής πολιτικής αποδεικνύεται εξαιρετικά πολύπλοκη.,Γ2 exam
ενδυνάμωση,укрепление,strengthening,Η ενδυνάμωση των τοπικών κοινοτήτων αποτελεί βασικό στόχο του νέου προγράμματος.,22 Aug
εξαιτίας,из-за,because of,"Εξαιτίας της ενεργειακής κρίσης, χιλιάδες νοικοκυριά αντιμετωπίζουν δυσκολίες θέρμανσης.",18 Mar — Prepositions
επιβραδύνω,замедлять,to slow down,Η γραφειοκρατία επιβραδύνει την υλοποίηση σημαντικών αναπτυξιακών έργων στη χώρα.,30 Sep
η ανάπτυξη,развитие,development,Η ανάπτυξη της χώρας εξαρτάται από τη σωστή αξιοποίηση των ευρωπαϊκών κονδυλίων.,21 Nov
κατάγομαι,происходить из,to descend from,Πολλοί Ελληνοαυστραλοί κατάγονται από νησιά του Αιγαίου που γνώρισαν μαζική μετανάστευση.,Part 4
κατακερματίζω,"дробить, фрагментировать",to fragment,Η πολιτική αστάθεια κατακερματίζει τις δυνάμεις που θα μπορούσαν να συνεργαστούν.,23 Sep
κατακερματισμένη προσοχή,раздробленное внимание,fragmented attention,Η κατακερματισμένη προσοχή των χρηστών δυσκολεύει τη βαθιά κατανόηση των ειδήσεων.,Ιστορία 20
κατακτήσεις του ανθρώπινου πνεύματος,достижения человеческого духа,achievements of the human intellect,Οι κατακτήσεις του ανθρώπινου πνεύματος πρέπει να γίνουν προσβάσιμες σε όλους τους πολίτες.,5 Dec
καταντώ,докатиться до (негативно),to end up (negatively),Η χώρα κινδυνεύει να καταντήσει παρατηρητής σε αποφάσεις που αφορούν τα δικά της ζητήματα.,16 Feb
καταργώ,упразднять / отменять,to abolish / cancel,Η κυβέρνηση καταργεί παρωχημένες διατάξεις που εμπόδιζαν την επιχειρηματικότητα.,3 Mar
Μεταβολές,изменения,Changes / Alterations,Μεταβολές στο φορολογικό πλαίσιο αναμένονται εντός του πρώτου εξαμήνου του έτους.,Γ2 exam
οι τύποι,формальности,formalities,Οι τύποι επιχειρήσεων που επωφελούνται είναι κυρίως μικρομεσαίες σύμφωνα με τη μελέτη.,14 May
παίρνω συνείδηση,осознавать,become conscious of,Οι πολίτες παίρνουν συνείδηση ότι η κλιματική αλλαγή τους αφορά άμεσα.,15 May
παρίσταμαι,присутствовать,be present / attend,Ο πρωθυπουργός παρίσταται στην τελετή μνήμης για τα θύματα της τραγωδίας.,18 Mar — ίσταμαι verbs
παρευρίσκομαι,присутствовать,attend,Εκατοντάδες πολίτες παρευρέθηκαν στην εκδήλωση αλληλεγγύης στο κέντρο της Αθήνας.,18 Mar — ίσταμαι verbs
παύω,прекращаю,to stop,Ο διευθυντής παύθηκε από τα καθήκοντά του μετά τα αποτελέσματα της έρευνας.,9 Dec
πραγματώνω,осуществлять / реализовывать,to fulfill / realize,Η χώρα πραγματώνει τον στόχο της ενεργειακής αυτονομίας μέσω ανανεώσιμων πηγών.,17 Mar
προκαλώ,провоцировать / вызывать,to provoke / to cause,Οι δηλώσεις του υπουργού προκαλούν αντιδράσεις σε ολόκληρο το πολιτικό φάσμα.,27 Feb
προκλητικός,провокационный,provocative,Ο προκλητικός τόνος της δήλωσης πυροδότησε έντονες αντιδράσεις στα κοινωνικά δίκτυα.,27 Jan
ρέπω,склоняться к,to tend / incline,Η κοινή γνώμη ρέπει προς τη στήριξη αυστηρότερων περιβαλλοντικών κανονισμών.,18 Mar
στενή τροχιά,узкая орбита,narrow orbit,Η κυβέρνηση κινείται σε στενή τροχιά ανάμεσα στη λιτότητα και την ανάπτυξη.,Γ2 exam
συγκέντρωση,концентрация,concentration,Η συγκέντρωση διαμαρτυρίας στο Σύνταγμα συγκέντρωσε χιλιάδες πολίτες χθες.,Ιστορία 34
συγκεκριμένος,конкретный / определённый,specific,Η κυβέρνηση πρέπει να παρουσιάσει συγκεκριμένο σχέδιο για τη μείωση της ανεργίας.,23 Dec
συγκεραννύω,"смешивать, сочетать","merge, blend",Η νέα πολιτική επιχειρεί να συγκεράσει οικονομική ανάπτυξη και κοινωνική αλληλεγγύη.,27 Jan
συγκινητικό,трогательное,"touching, moving",Το συγκινητικό ντοκιμαντέρ για τους πρόσφυγες κέρδισε βραβείο στο Φεστιβάλ Θεσσαλονίκης.,16 May
συνειδητοποιώ,осознавать,realize,"Συνειδητοποιώ ότι η αδράνεια μπορεί να αποβεί καταστροφική, τονίζει ο ακτιβιστής.",Γ2 exam
συνεργατική στάση,сотрудническая позиция,collaborative attitude,Η συνεργατική στάση μεταξύ κομμάτων οδήγησε στην ψήφιση του νομοσχεδίου.,Ιστορία 22
συντελώ,содействовать,to contribute,Πολλοί παράγοντες συντελούν στην αύξηση της ενεργειακής φτώχειας στην Ευρώπη.,22 Aug
τείνω,склоняться / стремиться,to tend / to stretch,Οι τιμές ακινήτων τείνουν να σταθεροποιηθούν μετά τη ραγδαία αύξηση των τελευταίων ετών.,24 Mar
τυπικότητες,формальности,formalities,Οι γραφειοκρατικές τυπικότητες καθυστερούν τη χορήγηση αδειών σε νέες επιχειρήσεις.,Ιστορία 30
Υλοποίηση,"реализация, осуществление",implementation,Η υλοποίηση του εθνικού σχεδίου ανάκαμψης βρίσκεται σε πλήρη εξέλιξη.,Γ2 exam
---,Абстрактные понятия,,,
ένδειξη,указание / признак,indication,Οι πρώτες ενδείξεις δείχνουν ότι η οικονομία ανακάμπτει σταδιακά μετά την κρίση.,27 Mar
αντικαταστάσει,заменить,to replace,Η τεχνητή νοημοσύνη δεν πρόκειται να αντικαταστήσει πλήρως τον ανθρώπινο παράγοντα.,Γ2 exam
διαστρέφω,искажать,to distort,Κατηγόρησε τα μέσα ενημέρωσης ότι διαστρέφουν τα λόγια του πρωθυπουργού.,9 May
η διάσταση,измерение / разногласие,dimension / disagreement,Η πολιτική διάσταση του ζητήματος προκάλεσε έντονη αντιπαράθεση στη Βουλή.,21 Mar
Η κατάσταση έχει ξεπεράσει τα όρια.,Ситуация вышла за рамки.,The situation has gone beyond limits.,"Σύμφωνα με τον δήμαρχο, η κατάσταση έχει ξεπεράσει τα όρια της ανοχής.",Фразы уровня Γ2
Η κατάσταση κλιμακώνεται διαρκώς.,Ситуация постоянно обостряется.,The situation is constantly escalating.,Η κατάσταση κλιμακώνεται διαρκώς και απαιτούνται άμεσα διπλωματικά μέτρα.,Фразы уровня Γ2
η υπόσταση,"сущность, статус","essence, status",Η νομική υπόσταση του οργανισμού αμφισβητήθηκε από την αντιπολίτευση.,25 Sep
συστάθηκε,был учреждён,was established,Συστάθηκε ανεξάρτητη επιτροπή για τη διερεύνηση των αιτιών του σιδηροδρομικού δυστυχήματος.,Γ2 exam
έντυπος,печатный,printed,Τα έντυπα μέσα ενημέρωσης αντιμετωπίζουν σοβαρή κρίση εσόδων στην Ελλάδα.,Γ2 exam
έρχομαι σε επαφή,вступать в контакт,come into contact,Οι δύο πλευρές ήρθαν σε επαφή μέσω διπλωματικών καναλιών χθες το βράδυ.,28 May
αμφιβάλλω,сомневаться,to doubt,Πολλοί αναλυτές αμφιβάλλουν για την αποτελεσματικότητα των νέων μέτρων.,9 May
καταβάλλω προσπάθεια,прилагать усилия,make an effort,Η κυβέρνηση καταβάλλει προσπάθεια να μειώσει τη γραφειοκρατία στον δημόσιο τομέα.,3 Feb
ανήκει,принадлежит,belongs,Το ακίνητο ανήκει στο ελληνικό δημόσιο και δεν μπορεί να εκποιηθεί.,10 Jan
ανήκω,принадлежу,to belong,Ανήκω σε μια γενιά που μεγάλωσε με τις συνέπειες της οικονομικής κρίσης.,17 Dec
ανήκω και στα δύο μέρη,принадлежать обоим местам,belong to both places,"Ως μετανάστης δεύτερης γενιάς, νιώθω ότι ανήκω και στα δύο μέρη ταυτόχρονα.",Ιστορία 42
ηλικία,возраст,age,Η μέση ηλικία των εργαζομένων στον κλάδο της τεχνολογίας μειώνεται σταθερά.,17 Dec
συνομήλικος,ровесник,"peer, of same age",Οι συνομήλικοί του μαθητές αντιμετωπίζουν παρόμοιες δυσκολίες στην αγορά εργασίας.,17 Dec
αναδεικνύω,выявлять / раскрывать,to highlight / reveal,Η έρευνα αναδεικνύει τις σοβαρές ελλείψεις του εκπαιδευτικού συστήματος.,21 Mar
επιδεικνύω,демонстрирую / показываю,"to display, show off",Ο πρωθυπουργός επιδεικνύει αυτοπεποίθηση παρά τις αντιδράσεις της αντιπολίτευσης.,21 Nov
διασκευή,адаптация,adaptation,Η θεατρική διασκευή του μυθιστορήματος σημείωσε μεγάλη εμπορική επιτυχία.,23 Oct — σκευή
Παρασκευή,пятница,Friday,Η ψηφοφορία αναμένεται να πραγματοποιηθεί την Παρασκευή στη Βουλή.,23 Oct — σκευή
ανεπάρκειας,недостаточности,insufficiency,Η χρόνια ανεπάρκεια υποδομών στη νησιωτική Ελλάδα εντείνει τις κοινωνικές ανισότητες.,Γ2 exam
η επάρκεια,"достаточность, компетентность",adequacy,Η ενεργειακή επάρκεια της χώρας παραμένει ζήτημα στρατηγικής σημασίας.,26 May
εκτυπώνω,печатать,to print,Η τρισδιάστατη εκτύπωση εκτυπώνει πλέον ακόμα και ανθρώπινους ιστούς για μεταμοσχεύσεις.,16 May
ανταποκρίνεται,"отвечает, соответствует ожиданиям","responds, meets expectations",Το νέο πρόγραμμα ανταποκρίνεται στις ανάγκες των νέων επιστημόνων στην περιφέρεια.,Γ2 exam
κατακρίνει,"осуждать, критиковать",to criticize,Η διεθνής κοινότητα κατακρίνει τις παραβιάσεις ανθρωπίνων δικαιωμάτων στην περιοχή.,Γ2 exam
συγκρίνω,сравнивать,compare,Δεν μπορούμε να συγκρίνουμε τις δύο καταστάσεις χωρίς να λάβουμε υπόψη το ιστορικό πλαίσιο.,27 Jan
φάσκω και αντιφάσκω,противоречить самому себе,to contradict oneself,Η κυβέρνηση φάσκει και αντιφάσκει σχετικά με τη φορολογική πολιτική της.,27 Mar
αντλία,насос,pump,Η αντλία του αρδευτικού συστήματος χρειάζεται άμεση αντικατάσταση λόγω παλαιότητας.,7 Oct
αντλία θερμότητας,тепловой насос,heat pump,Η εγκατάσταση αντλίας θερμότητας μειώνει το ενεργειακό κόστος κατά σαράντα τοις εκατό.,25 Feb
η απαίτηση,требование,requirement,Η απαίτηση για διαφάνεια στις δημόσιες συμβάσεις γίνεται ολοένα πιο επιτακτική.,14 Jan
επιβλέπω,надзирать,to supervise,Ο οργανισμός επιβλέπει την εφαρμογή των περιβαλλοντικών κανονισμών σε εθνικό επίπεδο.,16 May
παραβλέπω,"не замечать, упускать",to overlook,Δεν μπορούμε να παραβλέψουμε τις κοινωνικές επιπτώσεις της ψηφιακής μετάβασης.,16 May
εγκαθίσταμαι,устанавливаться,to be installed,"Πολυεθνικές εταιρείες εγκαθίστανται στην Ελλάδα, αξιοποιώντας τα φορολογικά κίνητρα.",30 Sep
περιστατικό,инцидент,incident,Το περιστατικό βίας στο κέντρο της Αθήνας προκάλεσε έντονες αντιδράσεις.,14 May
πολυδιάστατος,многомерный,multidimensional,Το μεταναστευτικό είναι ένα πολυδιάστατο ζήτημα που απαιτεί συνολική προσέγγιση.,27 Feb
υποκαθιστώ,замещать,to substitute,Η τεχνολογία δεν μπορεί να υποκαταστήσει πλήρως τον ανθρώπινο παράγοντα στην εκπαίδευση.,7 Mar
