greek,russian,english,example,category
οπλισμός / όπλο / οπλίτης,вооружение / оружие / воин,weaponry / weapon / soldier,Ο εκσυγχρονισμός του οπλισμού αποτελεί στρατηγική προτεραιότητα για τις ένοπλες δυνάμεις.,7 Mar
πηλίκιο,фуражка,military cap,Το πηλίκιο αποτελεί αναπόσπαστο μέρος της στρατιωτικής στολής στις εθνικές παρελάσεις.,30 May
πρώτη γραμμή του μετώπου,передовая линия фронта,front line,Οι πυροσβέστες στην πρώτη γραμμή του μετώπου δίνουν μάχη υπό αντίξοες συνθήκες.,21 Aug
τα μετόπισθεν,тыл,"rear, backline",Τα μετόπισθεν παρέχουν κρίσιμη υποστήριξη στις δυνάμεις που επιχειρούν στο πεδίο.,21 Aug
τα πυρηνικά όπλα,ядерное оружие,nuclear weapons,"Τα πυρηνικά όπλα παραμένουν απειλή για την ανθρωπότητα, τόνισε ο Γ.Γ. του ΟΗΕ.",0 Mar
το δρεπάνι,серп,scythe,Το δρεπάνι χρησιμοποιείται ακόμη σε ορεινά χωριά για τη θερινή συγκομιδή.,22 Aug
το σφυρί,молоток,hammer,"Ο δικαστής χτύπησε το σφυρί, ανακοινώνοντας την ιστορική απόφαση του δικαστηρίου.",22 Aug
το σφυροδρέπανο,серп и молот,hammer and sickle,Το σφυροδρέπανο παραμένει σύμβολο ιδεολογικής αντιπαράθεσης στη σύγχρονη πολιτική.,22 Aug
το τσεκούρι,топор,axe,Το τσεκούρι ως εργαλείο και σύμβολο εξετάζεται σε νέα αρχαιολογική μελέτη.,22 Aug
υπερασπιστής δικαιωμάτων,защитник прав,defender of rights,Ο υπερασπιστής δικαιωμάτων καταδίκασε τις παραβιάσεις που καταγράφηκαν στα σύνορα.,Ιστορία 21
φαντάρος,солдат (разг.),soldier (informal),Ο νεαρός φαντάρος ολοκλήρωσε τη θητεία του αφού υπηρέτησε στον Έβρο επί εννέα μήνες.,20 Dec
ύστερα,"позже, потом","later, afterwards","Ύστερα από μακρές διαπραγματεύσεις, οι δύο πλευρές κατέληξαν σε συμφωνία κατάπαυσης πυρός.",Γ2 exam
διχασμένος,разрывающийся / раздвоенный,torn / divided,Η κοινωνία παραμένει διχασμένη σχετικά με την αύξηση των αμυντικών δαπανών.,Ιστορία 42
κλίμακα,масштаб,scale,"Η ένταση κλιμακώθηκε σε μεγάλη κλίμακα, αναγκάζοντας τη διεθνή κοινότητα να παρέμβει.",19 Aug
---,География и путешествия,,,
άδεια παραμονής,вид на жительство,residence permit,Η διαδικασία χορήγησης άδειας παραμονής απλοποιείται μέσω της νέας ψηφιακής πλατφόρμας.,10 Mar
ήπειρος,континент,continent,Η ήπειρος της Αφρικής αναδεικνύεται σε νέο τουριστικό προορισμό για τους Ευρωπαίους.,21 Mar
αποσκευή,багаж,luggage,Νέοι κανόνες για τις αποσκευές χειρός τίθενται σε ισχύ στις πτήσεις εντός Ευρώπης.,23 Oct — σκευή
αυτοσχεδιάζω,импровизировать,to improvise,Η κυβέρνηση φαίνεται να αυτοσχεδιάζει αντί να εφαρμόζει ολοκληρωμένο σχέδιο δράσης.,16 May
διαδηλωτής/διαδηλώτρια,демонстрант,protester,Οι διαδηλωτές κατέκλυσαν τους δρόμους διαμαρτυρόμενοι για τις κλιματικές πολιτικές.,16 Feb
εκδρομή,экскурсия,excursion,Η σχολική εκδρομή στους Δελφούς δίνει στους μαθητές την ευκαιρία να γνωρίσουν τον αρχαίο πολιτισμό.,6 Jan
εξωτερικό,за границей,abroad,Χιλιάδες Έλληνες αναζητούν ευκαιρίες στο εξωτερικό λόγω της οικονομικής κρίσης.,Ιστορία 31
επιτάσσω / επίταξη,реквизировать / реквизиция,to requisition,Η κυβέρνηση επιτάσσει ξενοδοχεία για τη φιλοξενία σεισμόπληκτων στη Θεσσαλία.,17 Mar
η αυθεντικότητα,подлинность,authenticity,Η αυθεντικότητα της τοπικής κουλτούρας αποτελεί βασικό κίνητρο για τους τουρίστες.,26 May
η χερσόνησος,полуостров,peninsula,Η χερσόνησος του Άθω αποτελεί μοναδικό μνημείο πολιτιστικής κληρονομιάς παγκοσμίως.,13 Jan
ΗΠΑ,США,USA,Οι ΗΠΑ παραμένουν βασικός εμπορικός εταίρος της Ελλάδας στον τομέα της τεχνολογίας.,21 Mar
λειψυδρία,нехватка воды,water scarcity,"Η λειψυδρία πλήττει τα νησιά του Αιγαίου, αναγκάζοντας τις αρχές σε μεταφορά νερού.",14 May
μυστηριώδες νησί,таинственный остров,mysterious island,Ένα μυστηριώδες νησί στο Αιγαίο προσελκύει αρχαιολόγους μετά από νέα ανακάλυψη.,20 Mar
ο προορισμός,место назначения,destination,Η Σαντορίνη παραμένει ο δημοφιλέστερος προορισμός για ξένους τουρίστες στην Ελλάδα.,18 Nov
ορίστηκε,был назначен,was appointed,"Ορίστηκε νέος πρόεδρος του ΕΛΓΑ, με προτεραιότητα τη στήριξη των πληγέντων αγροτών.",Γ2 exam
παράξενο,странный,strange,"Παράξενο φαινόμενο παρατηρήθηκε στη λίμνη Κερκίνη, προκαλώντας ενδιαφέρον επιστημόνων.",9 Dec
Το φαινόμενο ενισχύεται από εξωτερικούς παράγοντες.,Явление усиливается внешними факторами.,The phenomenon is reinforced by external factors.,"Το φαινόμενο ενισχύεται από εξωτερικούς παράγοντες, εκτιμούν ερευνητές του Αστεροσκοπείου.",Фразы уровня Γ2
υπό + αιτιατική,"при, под",under,Η περιοχή τελεί υπό αιτιατική κατάσταση έκτακτης ανάγκης μετά τις πλημμύρες.,25 Sep
υπό την έννοια,в смысле,in the sense,"Υπό την έννοια της κοινωνικής δικαιοσύνης, η μεταρρύθμιση αποτελεί αδήριτη ανάγκη.",7 Mar
επιπτώσεις,последствия,consequences,Οι επιπτώσεις της κλιματικής αλλαγής γίνονται ορατές στα παράλια της Ελλάδας.,Ιστορία 32
επιπόλαιος,легкомысленный,"frivolous, careless",Η επιπόλαιη αντιμετώπιση του ζητήματος οδήγησε σε σοβαρές περιβαλλοντικές συνέπειες.,6 May
---,Спорт и тело,,,
άλμα σε μήκος,прыжок в длину,long jump,Η Ελληνίδα αθλήτρια κατέκτησε χρυσό μετάλλιο στο άλμα σε μήκος στο Ευρωπαϊκό Πρωτάθλημα.,22 Aug
άλμα σε ύψος,прыжок в высоту,high jump,Νέο πανελλήνιο ρεκόρ σημειώθηκε στο άλμα σε ύψος από τον 22χρονο αθλητή στη Θεσσαλονίκη.,22 Aug
αντιστοίχηση,соответствие / сопоставление,matching / correspondence,Η αντιστοίχηση αθλητικών επιδόσεων με διεθνή πρότυπα αποτελεί στόχο της ομοσπονδίας.,31 Mar
αντιστοιχώ,соответствовать,to correspond / match,Οι επιδόσεις των Ελλήνων αθλητών αντιστοιχούν πλέον στα υψηλότερα διεθνή πρότυπα.,31 Mar
ημιμαραθώνιος,полумарафон,half-marathon,Ο ημιμαραθώνιος της Αθήνας συγκέντρωσε πάνω από 25.000 δρομείς από 80 χώρες.,7 Mar
Μαραθώνιος αγώνας δρόμου,марафон,marathon,Ο Μαραθώνιος αγώνας δρόμου αποτελεί κορυφαίο αθλητικό γεγονός με ιστορικές ρίζες.,7 Mar
άλτης / άλτρια,прыгун / прыгунья,jumper,Η Ελληνίδα άλτρια προκρίθηκε στον τελικό των Ολυμπιακών Αγώνων με εντυπωσιακή επίδοση.,22 Aug
αλτήρας,штанга / гантеля,barbell / dumbbell,Η άρση αλτήρων αποτελεί βασική μέθοδο ενδυνάμωσης στον αθλητισμό υψηλών επιδόσεων.,22 Aug
βαράκια,гантели,dumbbells,Η γυμναστική με βαράκια στο σπίτι γνώρισε έκρηξη δημοτικότητας κατά την πανδημία.,22 Aug
γέρνω,наклоняюсь,"to lean, bend","Ο αθλητής γέρνει ελαφρά προς τα εμπρός στην εκκίνηση, ακολουθώντας τη νέα τεχνική.",21 Nov
δημόσιες μεταφορές,общественный транспорт,public transport,Οι δημόσιες μεταφορές ενισχύονται με νέα λεωφορεία και τραμ στην Αθήνα και τη Θεσσαλονίκη.,Ιστορία 32
η καταγραφή,"запись, фиксация",recording,Η καταγραφή των αθλητικών επιδόσεων γίνεται πλέον με ψηφιακά μέσα υψηλής ακρίβειας.,23 Sep
η ράχη,спина / хребет,back / ridge,Ο τραυματισμός στη ράχη τον ανάγκασε να αποσυρθεί από τους αγώνες της σεζόν.,21 Nov
ισορροπώ,балансирую,to balance,Η αθλήτρια ισορροπεί ανάμεσα στην αγωνιστική καριέρα και τις πανεπιστημιακές σπουδές της.,18 Nov
λάστιχο γυμναστικής,резинка для фитнеса,resistance band,Τα λάστιχα γυμναστικής αποτελούν οικονομική εναλλακτική για άσκηση εκτός γυμναστηρίου.,22 Aug
οροσειρά,горный хребет,mountain range,Η οροσειρά της Πίνδου αποτελεί δημοφιλή προορισμό για ορεινή ποδηλασία και πεζοπορία.,13 Jan
πηδώ,прыгать,to jump,Η ελληνική οικονομία πηδά από κρίση σε κρίση χωρίς μακροπρόθεσμο σχέδιο σταθεροποίησης.,22 Aug
πυγμαχία,бокс,boxing,"Η πυγμαχία κερδίζει ολοένα περισσότερο κοινό στην Ελλάδα, ιδίως μεταξύ νέων γυναικών.",22 Oct
το κορμί,тело,body,Το κορμί ως θέμα στη σύγχρονη τέχνη εκφράζει ερωτήματα ταυτότητας και ελευθερίας.,9 Dec
χάνω κιλά / βάρος,худею / теряю вес,to lose weight,Ειδικοί προειδοποιούν ότι η προσπάθεια να χάσει κανείς βάρος γρήγορα μπορεί να είναι επικίνδυνη.,18 Nov
απόδειξη,доказательство / чек,proof,Η επιστημονική απόδειξη συνδέει τη σωματική άσκηση με τη βελτίωση της ψυχικής υγείας.,27 Mar
συναναστρέφεται άτομα αμφίβολης αξιοπιστίας,общается с людьми сомнительной надёжности,associates with questionable people,"Ο κατηγορούμενος συναναστρέφεται άτομα αμφίβολης αξιοπιστίας, σύμφωνα με τις αρχές.",5 Mar — история о взломе
Απαιτεί χρόνο,требует времени,requires time,Η αποκατάσταση μετά από σοβαρό τραυματισμό απαιτεί χρόνο και υπομονή από τον αθλητή.,14 Jan
απαιτητικός,требовательный,demanding,Το πρόγραμμα προπόνησης είναι ιδιαίτερα απαιτητικό ενόψει των Ολυμπιακών Αγώνων.,27 Jan
απαιτώ,требовать,to demand,Οι αθλητές απαιτούν καλύτερες υποδομές και χρηματοδότηση από την πολιτεία.,7 Mar
Καθίσταται επιτακτική η ανάγκη για λύση.,Необходимость решения становится настоятельной.,The need for a solution becomes imperative.,Καθίσταται επιτακτική η ανάγκη για λύση στο ζήτημα των αθλητικών υποδομών στην περιφέρεια.,Фразы уровня Γ2
αυτόβουλος,добровольный / самостоятельный,voluntary / self-decided,Η αυτόβουλη συμμετοχή νέων εθελοντών στον αθλητισμό αυξάνεται σημαντικά κάθε χρόνο.,10 Mar
επιπλέον,кроме того / дополнительно,additionally,Επιπλέον μέτρα ασφαλείας θα ληφθούν στους αγώνες μετά τα πρόσφατα επεισόδια βίας.,17 Feb
ερασιτέχνης,любитель,amateur,"Ο ερασιτέχνης αστρονόμος ανακάλυψε νέο αστεροειδή, προκαλώντας εντύπωση στην επιστημονική κοινότητα.",27 Jan
ερασιτεχνικός,любительский,amateurish,Η ερασιτεχνική δημοσιογραφία στα μέσα κοινωνικής δικτύωσης εγείρει ζητήματα αξιοπιστίας.,27 Jan
πνευματική αυτενέργεια,интеллектуальная самостоятельность,intellectual self-agency,Η πνευματική αυτενέργεια αποτελεί βασικό στοιχείο της ολιστικής προσέγγισης στον αθλητισμό.,5 Dec
πνευματική καθαρότητα,ясность ума,mental clarity,Η πνευματική καθαρότητα βοηθά τους αθλητές να πετύχουν κορυφαίες επιδόσεις σε αγώνες.,Ιστορία 20
σχολαστική,тщательная,thorough,Η σχολαστική προετοιμασία της ομάδας αποδείχθηκε καθοριστική για τη νίκη στον τελικό.,5 Mar — история о взломе
αξιόλογος,"замечательный, значительный",remarkable,Η αξιόλογη επίδοση του νεαρού αθλητή τράβηξε την προσοχή ξένων ομοσπονδιών.,19 Aug
ελκυστικός,привлекательный,attractive,Ο αθλητικός τουρισμός γίνεται ολοένα πιο ελκυστικός για τους επισκέπτες της Ελλάδας.,6 May
Η συγκυρία δεν είναι τυχαία.,Обстоятельства не случайны.,The circumstances are not coincidental.,"Η συγκυρία δεν είναι τυχαία, σχολιάζουν αναλυτές για την αλλαγή ηγεσίας στην ομοσπονδία.",Фразы уровня Γ2
θανατηφόρα σύγκρουση,смертельное столкновение,fatal crash,"Θανατηφόρα σύγκρουση οχημάτων σημειώθηκε στην εθνική οδό, με δύο θύματα μεταξύ αθλητών.",30 Sep
οπωσδήποτε,"обязательно, непременно",certainly,Η μεταρρύθμιση πρέπει οπωσδήποτε να ολοκληρωθεί πριν τη λήξη της κοινοβουλευτικής περιόδου.,Γ2 exam
---,Строительство и жильё,,,
αναζήτηση,поиск,search / quest,Η αναζήτηση προσιτής κατοικίας αποτελεί πρόκληση για χιλιάδες νέους.,21 Mar
αναζητώ,искать,to search / seek,Οι αρχές αναζητούν τους υπεύθυνους για την παράνομη κατασκευή.,21 Mar
ανακατασκευή,реконструкция,reconstruction,Η ανακατασκευή του σταδίου θα ολοκληρωθεί πριν τους Ολυμπιακούς Αγώνες.,23 Oct — σκευή
κατασκευή,строительство,construction,Η κατασκευή του νέου μετρό αναμένεται να ξεκινήσει τον ερχόμενο μήνα.,23 Oct — σκευή
προκατασκευή,сборное строительство,prefabrication,Σπίτια προκατασκευής παραδόθηκαν στους σεισμοπαθείς μέσα σε λίγες εβδομάδες.,23 Oct — σκευή
αποδομημένος,деконструированный,deconstructed,Ο αποδομημένος τρόπος διδασκαλίας ενθαρρύνει την κριτική σκέψη.,22 Dec
εποικοδομητικός διάλογος,конструктивный диалог,constructive dialogue,Εποικοδομητικός διάλογος ξεκίνησε μεταξύ κυβέρνησης και κοινωνικών εταίρων.,Ιστορία 45
υποδομή,инфраструктура,infrastructure,Η υποδομή των δρόμων χρειάζεται άμεση αναβάθμιση στη βόρεια Ελλάδα.,9 Jan
θεμέλια,фундамент / основы,foundation,Τα θεμέλια του νέου νοσοκομείου τοποθετήθηκαν χθες σε ειδική τελετή.,20 Dec
το θεμέλιο,фундамент,foundation,Το θεμέλιο της δημοκρατίας είναι ο σεβασμός των ανθρωπίνων δικαιωμάτων.,14 Jan
άνω,выше / верхний,"above, upper",Οι θερμοκρασίες αναμένεται να φτάσουν άνω των 40 βαθμών το σαββατοκύριακο.,20 Dec
αποδομώ,деконструировать,deconstruct,Ο αναλυτής αποδομεί τα επιχειρήματα της κυβέρνησης για τον προϋπολογισμό.,22 Dec
βάφω,красить,to paint / dye,Εθελοντές βάφουν τα σχολεία της περιοχής πριν από τη νέα χρονιά.,5 Feb
βαμμένος,покрашенный,"painted, dyed",Ο βαμμένος τοίχος με γκράφιτι αποτελεί πλέον τουριστικό αξιοθέατο.,5 Feb
βούλομαι,желать / хотеть (арх.),I want / I will (archaic),Η κυβέρνηση βούλεται να ολοκληρώσει τις μεταρρυθμίσεις μέχρι τέλος του έτους.,10 Mar
διόροφος,двухэтажный,two-storey,Διόροφο κτίριο κατέρρευσε στο κέντρο της πόλης χωρίς θύματα.,9 Jan
εμπορικό κέντρο,торговый центр,mall,Νέο εμπορικό κέντρο ανοίγει στα νότια προάστια με 200 καταστήματα.,18 Nov
ενδοδαπέδια θέρμανση,тёплый пол,floor heating,Η ενδοδαπέδια θέρμανση μειώνει κατά 30% την κατανάλωση ενέργειας.,25 Feb
επιφανειακά likes,поверхностные лайки,superficial likes,Τα επιφανειακά likes δεν αντικατοπτρίζουν την πραγματική κοινωνική αλληλεπίδραση.,Ιστορία 39
η άσφαλτος,асфальт,asphalt,Η άσφαλτος στους κεντρικούς δρόμους ανανεώθηκε μετά τις ζημιές του χειμώνα.,5 Feb
μονοόροφος,одноэтажный,one-storey,Ο μονοόροφος σταθμός θα αντικατασταθεί από σύγχρονο πολυώροφο κτίριο.,9 Jan
οικόπεδο,участок под строительство,land for building,Η τιμή του οικοπέδου στο κέντρο ξεπερνά τα 3.000 ευρώ ανά τετραγωνικό.,6 Jan
οροφή,потолок,ceiling,Η οροφή του ιστορικού θεάτρου κατέρρευσε λόγω έλλειψης συντήρησης.,17 Mar
ουρανοξύστης,небоскрёб,skyscraper,Ο πρώτος ουρανοξύστης της Αθήνας θα φιλοξενήσει γραφεία και ξενοδοχείο.,18 Nov
πίστα,танцпол,dance floor,Η νέα πίστα αποπροσγειώσεων του αεροδρομίου παραδίδεται τον Σεπτέμβριο.,26 Dec
τάφρος,ров,moat,Αρχαιολογική τάφρος αποκαλύφθηκε κατά τη διάρκεια εκσκαφικών εργασιών.,6 Jan
το έρεισμα,опора / основание,foundation / base,Το έρεισμα του δρόμου καταστράφηκε από τις πλημμύρες και χρειάζεται επισκευή.,17 Mar
το ακίνητο,недвижимость,"property, real estate","Το ακίνητο πωλήθηκε σε τιμή ρεκόρ, σύμφωνα με τους μεσίτες.",21 Nov
το δάπεδο,пол (покрытие),floor,Το δάπεδο του νέου γυμναστηρίου είναι κατασκευασμένο από ανακυκλωμένα υλικά.,25 Feb
το περίπτερο,киоск,kiosk,Το περίπτερο της γειτονιάς κλείνει μετά από 40 χρόνια λειτουργίας.,21 Nov
τριόροφος,трёхэтажный,three-storey,Τριόροφη πολυκατοικία εκκενώθηκε μετά τον εντοπισμό ρωγμών στους τοίχους.,9 Jan
αποκατάσταση,восстановление,restoration,Η αποκατάσταση του ιστορικού κτιρίου χρηματοδοτείται από ευρωπαϊκό πρόγραμμα.,7 Mar
αποκαθιστώ,восстанавливать,to restore,Ο νόμος αποκαθιστά τα δικαιώματα θυμάτων πολιτικής δίωξης κατά τη μεταπολίτευση.,7 Mar
ενισχυμένη πραγματικότητα,дополненная реальность,augmented reality,Η ενισχυμένη πραγματικότητα χρησιμοποιείται πλέον σε μουσεία και εκπαίδευση.,16 May
ενισχύω,усиливать / укреплять,"to strengthen, empower",Η κυβέρνηση ενισχύει τις πυρόπληκτες περιοχές με 50 εκατομμύρια ευρώ.,31 Mar
ωφέλιμος,полезный,beneficial,Ο νέος νόμος θα είναι ωφέλιμος για χιλιάδες μικρές επιχειρήσεις.,22 Dec
αρμοδιότητα,"полномочие, компетенция","authority, responsibility",Η αρμοδιότητα για τη διαχείριση κρίσεων μεταβιβάζεται στο υπουργείο Εσωτερικών.,9 May
ας υποθέσουμε,давайте предположим,let's suppose,Ας υποθέσουμε ότι η ανεργία μειώνεται κατά 3% — θα αρκούσε αυτό για κοινωνική ανάκαμψη;,16 May
ελλειπτικότητα,неполнота,incompleteness,Η ελλειπτικότητα του κειμένου δημιουργεί αμφισημία στην ερμηνεία του νόμου.,22 Oct
θεμελιώδης,фундаментальный,fundamental,Η ελευθερία του Τύπου αποτελεί θεμελιώδες δικαίωμα κάθε δημοκρατίας.,Part 4
