greek,russian,english,example,category
Η ένταση έχει παγιωθεί.,Напряжение закрепилось.,The tension has become entrenched.,Η ένταση έχει παγιωθεί στις σχέσεις μεταξύ εργαζομένων και εργοδοτών στον κλάδο.,Фразы уровня Γ2
αίσθημα αδυναμίας,чувство беспомощности,feeling of helplessness,Το αίσθημα αδυναμίας που βιώνουν οι πολίτες τροφοδοτεί την πολιτική αποχή.,Ιστορία 40
αίσθηση απώλειας,чувство утраты,sense of loss,Η αίσθηση απώλειας ενισχύεται σε κοινωνίες που αλλάζουν ραγδαία χωρίς στήριξη.,Ιστορία 42
ενσυναίσθηση,эмпатия,empathy,"Η ενσυναίσθηση αποτελεί βασική δεξιότητα για τους επαγγελματίες υγείας, σύμφωνα με ειδικούς.",Ιστορία 45
ευαίσθητο σημείο,чувствительное место,sensitive spot,Η μεταναστευτική πολιτική παραμένει ευαίσθητο σημείο στις ελληνοτουρκικές σχέσεις.,Γ2 exam
συναισθηματική διαθεσιμότητα,эмоциональная доступность,emotional availability,Η συναισθηματική διαθεσιμότητα των γονέων επηρεάζει καθοριστικά την ψυχική υγεία του παιδιού.,Ιστορία 19
συναισθηματική νοημοσύνη,эмоциональный интеллект,emotional intelligence,Η συναισθηματική νοημοσύνη αναδεικνύεται σε βασικό κριτήριο επιλογής στελεχών στις επιχειρήσεις.,Ιστορία 19
συναισθηματική πίεση,эмоциональное давление,emotional pressure,Η συναισθηματική πίεση που δέχονται οι υγειονομικοί έχει φτάσει σε οριακό σημείο.,Ιστορία 17
αμήχανος,неловкий,awkward,Ο υπουργός φάνηκε αμήχανος όταν κλήθηκε να απαντήσει στις καταγγελίες δημοσίως.,23 Sep
αμηχανία,неловкость,awkwardness,Η αμηχανία της κυβέρνησης ήταν εμφανής στη χθεσινή συνέντευξη Τύπου για το σκάνδαλο.,21 Nov
ανία,скука,boredom,Η ανία στον χώρο εργασίας συνδέεται με αυξημένα ποσοστά επαγγελματικής εξουθένωσης.,12 Dec
η ανία / βαρεμάρα,скука,boredom,"Η ανία στα σχολεία συνδέεται με αναποτελεσματικές διδακτικές μεθόδους, τονίζουν παιδαγωγοί.",9 Dec
απογοήτευση,разочарование,disappointment,Η απογοήτευση των πολιτών αντικατοπτρίζεται στα υψηλά ποσοστά αποχής από τις εκλογές.,Ιστορία 38
απογοητεύω,разочаровывать,to disappoint,Τα αποτελέσματα του νέου νόμου απογοήτευσαν όσους περίμεναν ουσιαστικές αλλαγές στην παιδεία.,21 Mar
αποθαρρύνω,"отпугивать, обескураживать",to discourage,Τα γραφειοκρατικά εμπόδια αποθαρρύνουν νέους επιχειρηματίες από το να ιδρύσουν εταιρεία.,30 Sep
θάρρος,смелость,courage,Χρειάζεται θάρρος για να αντιμετωπίσει κανείς δημοσίως τα δομικά προβλήματα του συστήματος.,13 May
το θάρρος,смелость / мужество,courage,Το θάρρος που επέδειξαν οι μάρτυρες στη δίκη αποτέλεσε παράδειγμα για τους πολίτες.,17 Dec
αφέλεια,наивность,naivety,Θα ήταν αφέλεια να πιστεύουμε ότι το πρόβλημα λύνεται χωρίς διαρθρωτικές αλλαγές.,21 Mar
αφελής,наивный,naive,Η αφελής αντίληψη ότι η οικονομία αυτορυθμίζεται έχει διαψευστεί επανειλημμένα.,21 Mar
ενσυνειδητότητα,осознанность,mindfulness,Η ενσυνειδητότητα ως πρακτική κερδίζει έδαφος στα σχολεία και στους χώρους εργασίας.,Ιστορία 43
συνειδητή δράση,осознанное действие,conscious action,Η συνειδητή δράση των πολιτών μπορεί να λειτουργήσει ως αντίβαρο στην αδιαφορία.,Ιστορία 40
συνειδητή χρήση,осознанное использование,conscious use,Η συνειδητή χρήση της τεχνολογίας αποτελεί ζήτημα ψυχικής υγείας για τους εφήβους.,Ιστορία 33
εξευτελίζω,унижать,to humiliate,Ο νόμος προστατεύει τους πολίτες από πρακτικές που εξευτελίζουν την ανθρώπινη αξιοπρέπεια.,16 Feb
εξευτελισμός,унижение,humiliation,Ο δημόσιος εξευτελισμός αποτελεί μορφή ψυχολογικής βίας σύμφωνα με ευρωπαϊκή νομοθεσία.,16 Feb
σιωπή,тишина / молчание,silence,Η σιωπή των θεσμών απέναντι στις καταγγελίες προκάλεσε έντονες αντιδράσεις στα μέσα.,6 Jan
σιωπηλός,молчаливый,silent,Η σιωπηλή πλειοψηφία αποφάσισε τελικά να εκφράσει τη δυσαρέσκειά της στις κάλπες.,6 Jan
σιωπηρός,негласный / молчаливый,"discreet, quiet",Η σιωπηρή συμφωνία μεταξύ των δύο πλευρών αποκαλύφθηκε μετά τη δημοσιοποίηση εγγράφων.,6 Jan
τρυφερός,нежный,tender,Ο τρυφερός τρόπος με τον οποίο μίλησε για την οικογένειά του συγκίνησε το κοινό.,21 Nov
τρυφερότητα / τρυφεράδα,нежность,tenderness,Η τρυφερότητα στις ανθρώπινες σχέσεις αποτελεί ένδειξη συναισθηματικής ωριμότητας.,21 Nov
υπερήφανος,гордый,proud,Δήλωσε υπερήφανος για τη συμμετοχή του στην εθελοντική αποστολή βοήθειας στους πληγέντες.,3 Mar
υπερηφανεύομαι,гордиться,to be proud,Δεν αρκεί να υπερηφανευόμαστε για το παρελθόν· χρειάζεται δράση για το μέλλον.,3 Mar
ψυχική ανθεκτικότητα,психическая устойчивость,mental resilience,Η ψυχική ανθεκτικότητα ενισχύεται μέσω κοινωνικών δεσμών και συμβουλευτικής υποστήριξης.,Ιστορία 43
ψυχική ισορροπία,психическое равновесие,mental balance,Η ψυχική ισορροπία των εργαζομένων επηρεάζεται σοβαρά από τις συνθήκες εργασιακής ανασφάλειας.,Ιστορία 39
άγχος,стресс,stress,Το άγχος που βιώνουν οι νέοι εντείνεται λόγω οικονομικής αβεβαιότητας και ανεργίας.,Ιστορία 43
έκρηξη θυμού,вспышка гнева,outburst of anger,Η έκρηξη θυμού στα μέσα κοινωνικής δικτύωσης μετά την ανακοίνωση ήταν πρωτοφανής.,16 Feb
έντονο άγχος,сильная тревога,intense anxiety,Οι εκπαιδευτικοί αντιμετωπίζουν έντονο άγχος εξαιτίας των συνεχών αλλαγών στα αναλυτικά προγράμματα.,Ιστορία 17
αβεβαιότητα,неопределённость,uncertainty,Η αβεβαιότητα για το μέλλον αποτελεί τη βασική πηγή ψυχολογικής πίεσης στους πολίτες.,Ιστορία 38
αδημονώ,нетерпеливо жду,to long for,Οι πολίτες αδημονούν για τα αποτελέσματα των εκλογών που αναμένονται αργά το βράδυ.,9 Dec
αμίλητος,молчаливый,silent,Ο κατηγορούμενος παρέμεινε αμίλητος καθ' όλη τη διάρκεια της ακροαματικής διαδικασίας.,30 May
ανασφάλεια,неуверенность,insecurity,Η ανασφάλεια που νιώθουν οι εργαζόμενοι επηρεάζει αρνητικά την παραγωγικότητά τους.,Ιστορία 39
ανησυχία,беспокойство / тревога,worry / concern,Η ανησυχία των γονέων για τη χρήση διαδικτύου από τα παιδιά αυξάνεται συνεχώς.,Ιστορία 40
αντέχω,выдерживаю,to endure,Οι δημόσιες υποδομές δεν αντέχουν τις ακραίες θερμοκρασίες που πλήττουν τη Μεσόγειο.,9 Dec
Απαιτείται ψύχραιμη προσέγγιση.,Требуется хладнокровный подход.,A calm approach is required.,"Απαιτείται ψύχραιμη προσέγγιση για τη διαχείριση της κρίσης, τόνισε ο εκπρόσωπος.",Фразы уровня Γ2
αποκρουστικός,отвратительный,"disgusting, repulsive",Ο αποκρουστικός τρόπος με τον οποίο αντιμετωπίστηκαν οι πρόσφυγες προκάλεσε αντιδράσεις.,28 May
αποξένωση,отчуждение,alienation,Η αποξένωση των νέων από τους θεσμούς αποτελεί σοβαρό σημάδι κοινωνικής κρίσης.,Ιστορία 26
αποτυχία,неудача,failure,Η αποτυχία του προγράμματος αποδίδεται στην έλλειψη σχεδιασμού και πολιτικής βούλησης.,Ιστορία 38
γαλήνη,безмятежность,serenity,Η γαλήνη που χαρακτήριζε τη μικρή κοινότητα διαταράχθηκε από τις πρόσφατες εξελίξεις.,13 Jan
γενναίος,храбрый,brave,Ο γενναίος πυροσβέστης τιμήθηκε για τη δράση του κατά τις πυρκαγιές του καλοκαιριού.,27 Dec
γκρέμισμα,"снос, разрушение",demolition,Το γκρέμισμα αυθαιρέτων κτισμάτων στον αιγιαλό προκάλεσε αντιδράσεις σε τοπικό επίπεδο.,Γ2 exam
γλαρωμένα μάτια,уставшие / мутные глаза,tired/blurred eyes,"Με γλαρωμένα μάτια από την εξάντληση, οι διασώστες συνέχισαν τις έρευνες επί δύο ημέρες.",9 Dec
γλαρώνω,глаза слипаются,eyes grow heavy,"Μετά από ώρες συνεδρίασης, οι βουλευτές άρχισαν να γλαρώνουν στα έδρανα.",9 Dec
Δεν εξεπλάγην,Я не удивилась,I was not surprised,"Δεν εξεπλάγην από τα αποτελέσματα της έρευνας, δήλωσε ο καθηγητής κοινωνιολογίας.",5 Mar — история о взломе
Δημιουργείται αίσθημα ανασφάλειας.,Создаётся чувство небезопасности.,A sense of insecurity is being created.,Δημιουργείται αίσθημα ανασφάλειας στους κατοίκους λόγω της αύξησης των κλοπών στην περιοχή.,Фразы уровня Γ2
διάθεση,настроение,mood,"Η διάθεση των καταναλωτών παραμένει αρνητική, σύμφωνα με τον δείκτη εμπιστοσύνης.",Ιστορία 35
διαταραχή ύπνου,нарушение сна,sleep disorder,Η διαταραχή ύπνου αποτελεί πλέον ένα από τα πιο διαδεδομένα προβλήματα υγείας.,Ιστορία 17
διαχείριση άγχους,управление стрессом,stress management,Η διαχείριση άγχους μέσω τεχνικών χαλάρωσης εντάσσεται στα σχολικά προγράμματα.,Ιστορία 38
διστάζω / δισταγμός / διστακτικός,колебаться / колебание / нерешительный,to hesitate / hesitation / hesitant,Πολλοί πολίτες διστάζουν να αναζητήσουν ψυχολογική βοήθεια λόγω κοινωνικού στίγματος.,17 Mar
δοκιμαστικός,"пробный, экспериментальный","trial, experimental",Η δοκιμαστική εφαρμογή του προγράμματος ψυχολογικής στήριξης ξεκίνησε σε τρεις δήμους.,13 Feb
δυσαρέσκεια,недовольство,dissatisfaction,Η δυσαρέσκεια των εργαζομένων εντείνεται καθώς οι μισθοί παραμένουν καθηλωμένοι.,27 Feb
εθελοντισμός,волонтёрство,volunteering,"Ο εθελοντισμός ενισχύθηκε κατά τη διάρκεια της πανδημίας, δείχνοντας την αλληλεγγύη της κοινωνίας.",Ιστορία 38
εκνευρισμός,раздражение,irritation,Ο εκνευρισμός του πρωθυπουργού ήταν εμφανής στη χθεσινή συνέντευξη Τύπου για την ακρίβεια.,Ιστορία 34
εκπλήξεις,сюрпризы,surprises,Οι εκπλήξεις που επιφύλαξε η ψηφοφορία ανέτρεψαν τα δεδομένα στο πολιτικό σκηνικό.,20 Mar
εκφράζομαι με νηφαλιότητα,выражаться спокойно,express myself calmly,Ο εκπρόσωπος κλήθηκε να εκφράζεται με νηφαλιότητα παρά τις έντονες πιέσεις των δημοσιογράφων.,Ιστορία 40
ελπίδα,надежда,hope,Η ελπίδα για καλύτερες συνθήκες ζωής οδηγεί χιλιάδες νέους στο εξωτερικό κάθε χρόνο.,Ιστορία 40
εμφανώς ανήσυχη,явно обеспокоенная,visibly worried,Η υπουργός εμφανίστηκε εμφανώς ανήσυχη κατά τη διάρκεια της ενημέρωσης για τις πυρκαγιές.,5 Mar — история о взломе
ενοχές,чувство вины,guilt,Η ψυχολόγος εξηγεί πώς οι ενοχές μπορούν να μεταμορφωθούν σε κινητήριο δύναμη αλλαγής.,Γ2 exam
εντυπωσιάζομαι,впечатляться,I am impressed,"Δεν εντυπωσιάζομαι από τα νούμερα, αλλά από τις πραγματικές αλλαγές, δήλωσε ο αναλυτής.",31 Mar
εξαντλώ,истощать,to exhaust,Η ατελείωτη γραφειοκρατία εξαντλεί τους πολίτες που ζητούν πρόσβαση σε δημόσιες υπηρεσίες.,7 Oct
εξουθενώνω,изнурять,exhaust,"Η εργασιακή πίεση εξουθενώνει τους υγειονομικούς, προειδοποιούν τα ιατρικά συνδικάτα.",5 Dec
επεξεργάζομαι τα συναισθήματά μου,прорабатывать свои эмоции,process my emotions,Οι ψυχολόγοι τονίζουν τη σημασία του να επεξεργάζεται κανείς τα συναισθήματά του.,Ιστορία 17
επιφύλαξη,"оговорка, сдержанность",reservation / hesitation,Η αντιπολίτευση εξέφρασε επιφύλαξη για την αποτελεσματικότητα του νέου μέτρου στήριξης.,Γ2 exam
εσωτερική ένταση,внутреннее напряжение,inner tension,Η εσωτερική ένταση που βιώνουν οι εργαζόμενοι αντικατοπτρίζεται στα ποσοστά επαγγελματικής εξουθένωσης.,Ιστορία 17
ευζωία,благополучие,well-being,Η ευζωία των πολιτών πρέπει να αποτελεί βασικό κριτήριο αξιολόγησης κάθε πολιτικής.,24 Mar
ευημερία,благополучие,well-being,Η ευημερία δεν μετράται μόνο σε οικονομικούς δείκτες αλλά και σε ποιότητα ζωής.,Ιστορία 28
η αξιοπρέπεια,достоинство,dignity,Η αξιοπρέπεια του ανθρώπου αποτελεί αδιαπραγμάτευτη αρχή σε κάθε δημοκρατική κοινωνία.,25 Sep
Η εξέλιξη αυτή προκαλεί προβληματισμό.,Это развитие вызывает обеспокоенность.,This development raises concerns.,"Η εξέλιξη αυτή προκαλεί προβληματισμό, καθώς θέτει ερωτήματα για τη δημόσια υγεία.",Фразы уровня Γ2
η τόλμη,смелость (положит.),audacity (positive),Η τόλμη που χρειάζεται για μεταρρυθμίσεις φαίνεται να λείπει από τον πολιτικό κόσμο.,13 May
ισορροπία,равновесие / баланс,balance,Η ισορροπία μεταξύ επαγγελματικής και προσωπικής ζωής αποτελεί ζήτημα δημόσιας υγείας.,18 Nov
κίνητρο,мотивация / стимул,motivation,Η έλλειψη κινήτρου αποτελεί βασικό παράγοντα της μαθητικής διαρροής στη δευτεροβάθμια εκπαίδευση.,13 Jan
κακοποιητικός,жестокий / оскорбительный,abusive / harmful,Η κακοποιητική συμπεριφορά στον χώρο εργασίας αποτελεί πλέον αντικείμενο νομοθετικής ρύθμισης.,20 Feb
κακόμοιρος,бедняга / несчастный,"poor, unfortunate",Ο κακόμοιρος εργάτης βρέθηκε χωρίς εργασία και στέγη μέσα σε λίγες μέρες.,9 Dec
καλύπτουν τις ανάγκες,покрывают потребности,meet the needs,Τα υπάρχοντα κέντρα υγείας δεν καλύπτουν τις ανάγκες του πληθυσμού στην περιφέρεια.,Γ2 exam
καταβεβλημένος,измождённый / обессиленный,exhausted / drained,Ο καταβεβλημένος πληθυσμός ζητά ουσιαστικά μέτρα ανακούφισης από την οικονομική κρίση.,Ιστορία 34
κοιτώ κλεφτά,подглядываю,to glance secretly,"Οι πολίτες κοιτούν κλεφτά τα νούμερα της ανεργίας, φοβούμενοι για τη δική τους θέση.",9 Dec
κυκλοθυμικός,переменчивый в настроении,moody,Η κυκλοθυμική στάση της αγοράς αντικατοπτρίζει τη γενικότερη αβεβαιότητα στην οικονομία.,13 May
μέσος όρος,среднее значение,average,Ο μέσος όρος ικανοποίησης των πολιτών από τις δημόσιες υπηρεσίες παραμένει χαμηλός.,22 Dec
με ανατρίχιασε,у меня мурашки пошли,it gave me chills,"Η μαρτυρία της με ανατρίχιασε, δήλωσε ο εισαγγελέας μετά τη δίκη για τα Τέμπη.",5 Mar — история о взломе
μισώ,ненавижу,to hate,Η ρητορική μίσους στα κοινωνικά δίκτυα δείχνει πόσο εύκολα κάποιοι μαθαίνουν να μισούν.,9 Dec
μοναξιά,одиночество,loneliness,"Η μοναξιά αποτελεί κρυφή επιδημία στις σύγχρονες αστικές κοινωνίες, σύμφωνα με τον ΠΟΥ.",Ιστορία 35
νιώθω άβολα,чувствовать себя неловко,to feel uncomfortable,Οι δημοσιογράφοι ένιωθαν άβολα κατά τη συνέντευξη Τύπου λόγω των αιχμηρών ερωτήσεων.,30 Sep
νοητική κόπωση,умственная усталость,mental fatigue,Η νοητική κόπωση που προκαλεί η υπερβολική χρήση οθονών απασχολεί τους νευρολόγους.,Ιστορία 20
νοοτροπία,менталитет,mentality,Η νοοτροπία του «βολέματος» αποτελεί εμπόδιο στον εκσυγχρονισμό της δημόσιας διοίκησης.,20 Dec
ξέσπασμα,вспышка,outburst,Το ξέσπασμα οργής των κατοίκων ήταν αναμενόμενο μετά τις αλλεπάλληλες πλημμύρες.,30 Sep
οδική οργή,агрессия на дороге,road rage,Τα περιστατικά οδικής οργής αυξάνονται ανησυχητικά στους δρόμους της πρωτεύουσας.,30 Sep
ούρλιαζαν σπαρακτικά,кричали душераздирающе,were screaming desperately,"Οι μητέρες ούρλιαζαν σπαρακτικά, περιγράφει αυτόπτης μάρτυρας του σεισμού.",5 Mar — история о взломе
παίρνω αγκαλιά,обнимаю,hug,Η εικόνα του πυροσβέστη που παίρνει αγκαλιά το παιδί συγκίνησε ολόκληρη τη χώρα.,6 Jan
παιδική χαρά,детская площадка,playground,Η παιδική χαρά του δήμου ανακαινίστηκε με πόρους από ευρωπαϊκό πρόγραμμα στήριξης.,14 Jan
παρορμητικά,импульсивно,impulsively,Οι ειδικοί προειδοποιούν ότι οι νέοι τείνουν να δρουν παρορμητικά στα κοινωνικά δίκτυα.,Ιστορία 27
ποθώ,страстно желать,to long for,Μια κοινωνία που ποθεί την αλλαγή πρέπει πρώτα να αλλάξει νοοτροπία και στάση.,10 Mar
προσβλητικό σχόλιο,оскорбительный комментарий,offensive comment,Ένα προσβλητικό σχόλιο στα μέσα κοινωνικής δικτύωσης μπορεί να οδηγήσει σε ποινική δίωξη.,Ιστορία 44
στίγμα,стигма,stigma,Το στίγμα γύρω από τα ψυχικά νοσήματα εμποδίζει πολλούς να αναζητήσουν βοήθεια.,Ιστορία 17
στοχασμός / αναστοχασμός,размышление / рефлексия,reflection,Ο αναστοχασμός πάνω στα λάθη του παρελθόντος αποτελεί προϋπόθεση πολιτικής ωρίμανσης.,Part 4
συγκίνηση,"волнение, эмоция",emotion,Η συγκίνηση ήταν εμφανής στα πρόσωπα των διασωθέντων μετά τη ναυτική τραγωδία.,Γ2 exam
συμβουλευτική υποστήριξη,консультационная поддержка,counseling support,Η συμβουλευτική υποστήριξη θα πρέπει να είναι προσβάσιμη σε κάθε πολίτη μέσω του ΕΣΥ.,Ιστορία 17
τεκμηριωμένα,документально подтверждённо,"documented, substantiated",Η έρευνα βασίζεται σε τεκμηριωμένα στοιχεία που αντλήθηκαν από αρχεία δύο δεκαετιών.,Γ2 exam
το εὖ ζην,"хорошая жизнь, благополучие",well-being,Το εὖ ζην δεν αφορά μόνο την υλική ευμάρεια αλλά και την ψυχική ισορροπία.,Αρχαία απαρέμφατα
